{
  "id": "nlp-005-english-notes-v0",
  "task": "tokenize",
  "language": "en",
  "dataset_id": "qualia-english-notes-v0",
  "dataset_revision": "authored-2026-09-14",
  "split": "test",
  "split_hash": "020c1caadff0ccbbba230b52e4547070c71f64354b19d8f51527560240ed0f0b",
  "domain": "english-general-notes",
  "profile": "symbolic-lite",
  "label_mapping": "identity",
  "scorer_revision": null,
  "primary_metric": "span_in_source",
  "metric_names": ["span_in_source", "sentence_span_is_source_slice", "token_text_is_source_slice"],
  "minimum_score": null,
  "baseline_score": null,
  "noninferiority_margin": null,
  "minimum_effect": null,
  "confidence_method": "none",
  "coverage_floor": null,
  "latency_budget": null,
  "memory_budget": "42MiB",
  "release_required": false,
  "gate_status": "UNEVALUATED",
  "unavailable_reason": null,
  "seed": 42,
  "seed_policy": "frozen-u64-42",
  "resource_envelope": {
    "max_source_bytes": 16384,
    "max_working_memory_bytes": 44040192,
    "network": "forbidden",
    "download_datasets": false,
    "download_models": false
  },
  "corpus": [],
  "notes": "NLP-005 authored UC-B gold lives at docs/benchmark-datasets/nlp/qualia-english-notes-v0/. Includes honest Dr. split (current splitter). Unset minimum_score remains UNEVALUATED. Not an F1 or Stanford result."
}
