{
  "id": "nlp-004-ud-en-ewt-tokenize",
  "task": "tokenize",
  "language": "en",
  "dataset_id": "ud-english-ewt",
  "dataset_revision": null,
  "split": "test",
  "split_hash": null,
  "domain": "general",
  "profile": "symbolic-lite",
  "label_mapping": "ud-word",
  "scorer_revision": null,
  "primary_metric": "boundary_f1",
  "metric_names": ["boundary_f1", "document_exact_match"],
  "minimum_score": null,
  "baseline_score": null,
  "noninferiority_margin": null,
  "minimum_effect": null,
  "confidence_method": "none",
  "coverage_floor": null,
  "latency_budget": null,
  "memory_budget": "42MiB",
  "release_required": true,
  "gate_status": "unavailable",
  "unavailable_reason": "Universal Dependencies English EWT is not present in this checkout. The treebank is separately licensed (UD license / original PTB-derived portions) and must not be downloaded by CI. NLP-005 records license, local path, and split hashes before this row can be scored. Metric names are inventory only; no F1 is computed.",
  "seed": 42,
  "seed_policy": "frozen-u64-42",
  "resource_envelope": {
    "max_source_bytes": 16777216,
    "max_working_memory_bytes": 44040192,
    "network": "forbidden",
    "download_datasets": false,
    "download_models": false
  },
  "corpus": [],
  "notes": "External dataset stub. Status unavailable. Must not pass a release gate."
}
