{
  "id": "nlp-004-schema-example",
  "task": "tokenize",
  "language": "en",
  "dataset_id": "example-not-a-corpus",
  "dataset_revision": null,
  "split": "smoke",
  "split_hash": null,
  "domain": "example",
  "profile": "symbolic-lite",
  "label_mapping": "identity",
  "scorer_revision": null,
  "primary_metric": "span_in_source",
  "metric_names": ["span_in_source", "token_text_is_source_slice"],
  "minimum_score": null,
  "baseline_score": null,
  "noninferiority_margin": null,
  "minimum_effect": null,
  "confidence_method": "none",
  "coverage_floor": null,
  "latency_budget": null,
  "memory_budget": "42MiB",
  "release_required": false,
  "gate_status": "UNEVALUATED",
  "unavailable_reason": null,
  "seed": 42,
  "seed_policy": "frozen-u64-42",
  "resource_envelope": {
    "max_source_bytes": 4096,
    "max_working_memory_bytes": 44040192,
    "network": "forbidden",
    "download_datasets": false,
    "download_models": false
  },
  "corpus": ["Example sentence for schema documentation only."],
  "notes": "Documented example. Unset minimum_score remains UNEVALUATED and never passes a release gate. Not an F1 or accuracy result."
}
