{
  "id": "nlp-005-ontonotes-unavailable",
  "task": "coref_resolve",
  "language": "en",
  "dataset_id": "ontonotes",
  "dataset_revision": null,
  "split": "test",
  "split_hash": null,
  "domain": "general",
  "profile": "symbolic-lite",
  "label_mapping": "ontonotes",
  "scorer_revision": null,
  "primary_metric": "coref_f1",
  "metric_names": ["coref_f1", "ner_f1"],
  "minimum_score": null,
  "baseline_score": null,
  "noninferiority_margin": null,
  "minimum_effect": null,
  "confidence_method": "none",
  "coverage_floor": null,
  "latency_budget": null,
  "memory_budget": "42MiB",
  "release_required": true,
  "gate_status": "unavailable",
  "unavailable_reason": "OntoNotes is not present in this checkout. It is separately licensed and must not be downloaded by CI. NLP-005 records it as unavailable (not present, not downloaded). Metric names are inventory only; no F1 is computed.",
  "seed": 42,
  "seed_policy": "frozen-u64-42",
  "resource_envelope": {
    "max_source_bytes": 16777216,
    "max_working_memory_bytes": 44040192,
    "network": "forbidden",
    "download_datasets": false,
    "download_models": false
  },
  "corpus": [],
  "notes": "External dataset stub. Status unavailable. Must not pass a release gate."
}
